<?xml version="1.0" encoding="UTF-8"?>

<FlatWare xmlns:xsi="http://www.w3.org/2001/XMLSchema-instance"
          xsi:noNamespaceSchemaLocation="flatware.xsd">

    <Item>
        <Type>Нож</Type>
        <Origin>Германия</Origin>

        <Visual>
            <BladeLength>20</BladeLength>
            <BladeWidth>30</BladeWidth>
            <Material>Сталь</Material>
            <Handle type="wood">Дуб</Handle>
        </Visual>

        <Value>true</Value>
    </Item>

    <Item>
        <Type>Вилка</Type>
        <Origin>Франция</Origin>

        <Visual>
            <ToothLength>15</ToothLength>
            <BladeWidth>20</BladeWidth>
            <Material>Сталь</Material>
            <Handle type="metal">Металл</Handle>
        </Visual>

        <Value>false</Value>
    </Item>

    <Item>
        <Type>Ложка</Type>
        <Origin>Италия</Origin>

        <Visual>
            <BladeLength>12</BladeLength>
            <BladeWidth>25</BladeWidth>
            <Material>Медь</Material>
            <Handle type="plastic">Пластик</Handle>
        </Visual>

        <Value>true</Value>
    </Item>

</FlatWare>